{
  "schemaVersion": 1,
  "documentId": "darovan_d09_governance_fiscal_defense_security",
  "version": "0.1",
  "phase": "D09",
  "preparedAt": "2026-10-22",
  "status": "planning_reference_not_runtime",
  "canonStatus": "author_approved_17_conceptual_choices_no_local_statutes",
  "authorityChain": [
    "nimroel_core",
    "norgard_defaults",
    "casa_darovan",
    "locality",
    "world_state"
  ],
  "sourceRefs": {
    "auditD09": "Worldbuilding/Reinos/Reinos de los Hombres/Norgard/Territorios/Casa Darovan/Auditorias/D09_AUDITORIA_CANON_Y_APROBACIONES_2026-10-22.md",
    "governmentD09": "Worldbuilding/Reinos/Reinos de los Hombres/Norgard/Territorios/Casa Darovan/Administracion_y_fiscalidad/D09_GOBIERNO_Y_JUSTICIA_v0.1.md",
    "fiscalD09": "Worldbuilding/Reinos/Reinos de los Hombres/Norgard/Territorios/Casa Darovan/Administracion_y_fiscalidad/D09_FISCALIDAD_Y_CONTROLES_v0.1.md",
    "securityD09": "Worldbuilding/Reinos/Reinos de los Hombres/Norgard/Territorios/Casa Darovan/Seguridad_y_defensa/D09_GUARDIAS_DEFENSA_RESPUESTA_v0.1.md",
    "d04": "Worldbuilding/Reinos/Reinos de los Hombres/Norgard/Territorios/Casa Darovan/Datos operativos/darovan_d04_resources_production_v0.1.json",
    "d05": "Worldbuilding/Reinos/Reinos de los Hombres/Norgard/Territorios/Casa Darovan/Datos operativos/darovan_d05_mobility_communications_v0.1.json",
    "d06": "Worldbuilding/Reinos/Reinos de los Hombres/Norgard/Territorios/Casa Darovan/Datos operativos/darovan_d06_settlement_rules_v0.1.json",
    "d07": "Worldbuilding/Reinos/Reinos de los Hombres/Norgard/Territorios/Casa Darovan/Datos operativos/darovan_d07_canonical_cities_v0.1.json",
    "d08": "Worldbuilding/Reinos/Reinos de los Hombres/Norgard/Territorios/Casa Darovan/Datos operativos/darovan_d08_population_services_v0.1.json",
    "treihord": "Worldbuilding/Reinos/Reinos de los Hombres/Norgard/Ciudades/Casa Darovan/Treihord.md",
    "crownGovernance": "Worldbuilding/Reinos/Reinos de los Hombres/Norgard/Gobierno y leyes/organizacion_del_reino.md",
    "monetary": "Worldbuilding/Reinos/Reinos de los Hombres/Norgard/Gobierno y leyes/moneda_y_acunacion.md",
    "fiscalCanon": "Worldbuilding/Reinos/Reinos de los Hombres/Norgard/Gobierno y leyes/sistema_fiscal_y_aduanero_v0.1.md",
    "militaryCanon": "Worldbuilding/Reinos/Reinos de los Hombres/Norgard/Gobierno y leyes/sistema_militar_norgard_v0.1.md",
    "kingsJustice": "Worldbuilding/Sistemas/Norgard Defaults/08_Sistema_penal/SISTEMA_PENAL_Y_JUSTICIA_DEL_REY_NORGARD_v0.1.md",
    "navy": "Worldbuilding/Sistemas/Norgard Defaults/06_Armada_real/armada_real_norgard_v0.1.md",
    "norgardFiscal": "Worldbuilding/Sistemas/Norgard Defaults/Datos operativos/norgard_fiscal_customs_default_v0.1.json",
    "norgardMilitary": "Worldbuilding/Sistemas/Norgard Defaults/Datos operativos/norgard_military_authority_house_forces_default_v0.1.json",
    "norgardPenal": "Worldbuilding/Sistemas/Norgard Defaults/Datos operativos/norgard_penal_code_v0.1.json",
    "norgardProcedure": "Worldbuilding/Sistemas/Norgard Defaults/Datos operativos/norgard_kings_justice_procedure_v0.1.json",
    "norgardNavy": "Worldbuilding/Sistemas/Norgard Defaults/Datos operativos/norgard_royal_navy_default_v0.1.json",
    "norgardProperty": "Worldbuilding/Sistemas/Norgard Defaults/Datos operativos/norgard_property_inheritance_rental_default_v0.1.json",
    "norgardAge": "Worldbuilding/Sistemas/Norgard Defaults/Datos operativos/norgard_age_capacity_labor_apprenticeship_default_v0.1.json",
    "coreLegal": "Worldbuilding/Sistemas/Nimroel Core/Datos operativos/nimroel_legal_case_sentence_contract_v0.1.json",
    "coreTxn": "Worldbuilding/Sistemas/Nimroel Core/Datos operativos/nimroel_transaction_obligation_ledger_contract_v0.1.json",
    "coreOwn": "Worldbuilding/Sistemas/Nimroel Core/Datos operativos/nimroel_property_possession_object_contract_v0.1.json",
    "coreEmergency": "Worldbuilding/Sistemas/Nimroel Core/Datos operativos/nimroel_emergency_personal_response_contract_v0.1.json",
    "coreMessaging": "Worldbuilding/Sistemas/Nimroel Core/Datos operativos/nimroel_messaging_letters_delivery_contract_v0.1.json"
  },
  "authorDecisions": [
    {
      "id": "DAR-D09-G01",
      "option": "B",
      "scope": "territorial_central_direction_functional_delegation",
      "provenance": "AUTHORED_CONCEPT",
      "approval": "AUTHOR_BATCH_2026-10-22",
      "createsNewTax": false,
      "createsNamedInstitution": false,
      "instantiatesRuntime": false
    },
    {
      "id": "DAR-D09-G02",
      "option": "B",
      "scope": "consultation_existing_local_actors_no_new_council",
      "provenance": "AUTHORED_CONCEPT",
      "approval": "AUTHOR_BATCH_2026-10-22",
      "createsNewTax": false,
      "createsNamedInstitution": false,
      "instantiatesRuntime": false
    },
    {
      "id": "DAR-D09-G03",
      "option": "B",
      "scope": "subordinate_rural_island_function_unknown_boundaries",
      "provenance": "AUTHORED_CONCEPT",
      "approval": "AUTHOR_BATCH_2026-10-22",
      "createsNewTax": false,
      "createsNamedInstitution": false,
      "instantiatesRuntime": false
    },
    {
      "id": "DAR-D09-G04",
      "option": "B",
      "scope": "four_cities_ordinary_justice_itinerant_minor_locations",
      "provenance": "AUTHORED_CONCEPT",
      "approval": "AUTHOR_BATCH_2026-10-22",
      "createsNewTax": false,
      "createsNamedInstitution": false,
      "instantiatesRuntime": false
    },
    {
      "id": "DAR-D09-G05",
      "option": "C",
      "scope": "capital_sentence_confirming_officer_unknown",
      "provenance": "AUTHORED_CONCEPT",
      "approval": "AUTHOR_BATCH_2026-10-22",
      "createsNewTax": false,
      "createsNamedInstitution": false,
      "instantiatesRuntime": false
    },
    {
      "id": "DAR-D09-G06",
      "option": "A",
      "scope": "minor_house_identities_and_existence_unknown",
      "provenance": "AUTHORED_CONCEPT",
      "approval": "AUTHOR_BATCH_2026-10-22",
      "createsNewTax": false,
      "createsNamedInstitution": false,
      "instantiatesRuntime": false
    },
    {
      "id": "DAR-D09-F01",
      "option": "B",
      "scope": "local_records_central_reconciliation_crown_accountability",
      "provenance": "AUTHORED_CONCEPT",
      "approval": "AUTHOR_BATCH_2026-10-22",
      "createsNewTax": false,
      "createsNamedInstitution": false,
      "instantiatesRuntime": false
    },
    {
      "id": "DAR-D09-F02",
      "option": "C",
      "scope": "veldora_royal_customs_darovan_support",
      "provenance": "AUTHORED_CONCEPT",
      "approval": "AUTHOR_BATCH_2026-10-22",
      "createsNewTax": false,
      "createsNamedInstitution": false,
      "instantiatesRuntime": false
    },
    {
      "id": "DAR-D09-F03",
      "option": "B",
      "scope": "crisol_records_checked_by_crown",
      "provenance": "AUTHORED_CONCEPT",
      "approval": "AUTHOR_BATCH_2026-10-22",
      "createsNewTax": false,
      "createsNamedInstitution": false,
      "instantiatesRuntime": false
    },
    {
      "id": "DAR-D09-F04",
      "option": "C",
      "scope": "remittance_period_and_rate_unknown",
      "provenance": "AUTHORED_CONCEPT",
      "approval": "AUTHOR_BATCH_2026-10-22",
      "createsNewTax": false,
      "createsNamedInstitution": false,
      "instantiatesRuntime": false
    },
    {
      "id": "DAR-D09-D01",
      "option": "A",
      "scope": "house_guard_boveda_crisol_vena_escorts",
      "provenance": "AUTHORED_CONCEPT",
      "approval": "AUTHOR_BATCH_2026-10-22",
      "createsNewTax": false,
      "createsNamedInstitution": false,
      "instantiatesRuntime": false
    },
    {
      "id": "DAR-D09-D02",
      "option": "C",
      "scope": "locally_scoped_guards_territorial_coordination",
      "provenance": "AUTHORED_CONCEPT",
      "approval": "AUTHOR_BATCH_2026-10-22",
      "createsNewTax": false,
      "createsNamedInstitution": false,
      "instantiatesRuntime": false
    },
    {
      "id": "DAR-D09-D03",
      "option": "C",
      "scope": "balanced_professional_defense_threat_response",
      "provenance": "AUTHORED_CONCEPT",
      "approval": "AUTHOR_BATCH_2026-10-22",
      "createsNewTax": false,
      "createsNamedInstitution": false,
      "instantiatesRuntime": false
    },
    {
      "id": "DAR-D09-D04",
      "option": "A",
      "scope": "syvaris_terrestrial_darovan_naval_crown",
      "provenance": "AUTHORED_CONCEPT",
      "approval": "AUTHOR_BATCH_2026-10-22",
      "createsNewTax": false,
      "createsNamedInstitution": false,
      "instantiatesRuntime": false
    },
    {
      "id": "DAR-D09-S01",
      "option": "B",
      "scope": "risk_based_resource_bound_patrols",
      "provenance": "AUTHORED_CONCEPT",
      "approval": "AUTHOR_BATCH_2026-10-22",
      "createsNewTax": false,
      "createsNamedInstitution": false,
      "instantiatesRuntime": false
    },
    {
      "id": "DAR-D09-S02",
      "option": "C",
      "scope": "mixed_escort_by_owner_risk_and_authority",
      "provenance": "AUTHORED_CONCEPT",
      "approval": "AUTHOR_BATCH_2026-10-22",
      "createsNewTax": false,
      "createsNamedInstitution": false,
      "instantiatesRuntime": false
    },
    {
      "id": "DAR-D09-S03",
      "option": "B",
      "scope": "vena_joint_authorization_and_custody",
      "provenance": "AUTHORED_CONCEPT",
      "approval": "AUTHOR_BATCH_2026-10-22",
      "createsNewTax": false,
      "createsNamedInstitution": false,
      "instantiatesRuntime": false
    }
  ],
  "government": {
    "crownSupreme": true,
    "houseIndependentLegislation": false,
    "houseSovereign": false,
    "seat": "treihord",
    "delegation": "functional_local_subordinate",
    "consultation": "existing_actors_nonbinding_no_council_created",
    "ruralAdministration": "subordinate_undelimited",
    "arvenAdminHouse": "casa_darovan",
    "karsathExcluded": true,
    "royalEnvoyTreihord": {
      "exists": true,
      "role": "fiscal_oversight",
      "operatesDarovanFacilities": false
    },